id,created_at,text
1337504231822069764,2020-12-11 21:07:13,Federal agents raid a Nevada company they say sold untraceable “ghost gun” parts that were used in hundreds of crim… https://t.co/c2eu3mNnRS
1337501607844524032,2020-12-11 20:56:47,"A 21-year-old man is in custody in connection with the fatal shooting of Nashville nurse Caitlyn Kaufman, Nashville… https://t.co/LYRtc6VU4x"
1337499161457987585,2020-12-11 20:47:04,An iceberg weighing hundreds of billions of metric tons is heading in the direction of an island that's home to mil… https://t.co/EvRHukBXOI
1337495051216281603,2020-12-11 20:30:44,The White House told FDA chief Stephen Hahn that he needs to have Pfizer/BioNTech's Covid vaccine authorized by the… https://t.co/opXpLdLUB9
1337493824009084929,2020-12-11 20:25:51,"""History will scorn the cowards who meekly complied with Trump's scheme to tarnish and overturn the election -- and… https://t.co/w6tbeOLmoA"
1337489862505750531,2020-12-11 20:10:07,Keanon Lowe prevented a potential tragedy last year when he disarmed — and then hugged — a young student who brough… https://t.co/Xr20J2bl26
1337487371525353472,2020-12-11 20:00:13,"Harrison Ford will be grabbing his whip and ramming on his hat for a fifth ""Indiana Jones"" movie, Disney has confir… https://t.co/vQRXdHmeM7"
1337484819450695681,2020-12-11 19:50:04,A Florida business owner who was once down on his luck is giving back by covering the utility bills of 114 families… https://t.co/KtYwyUQHiS
1337482317628141569,2020-12-11 19:40:08,"Covid-19 can lead to neurological complications, including strokes, seizures and movement disorders, researchers ha… https://t.co/mTqyhAXQtv"
1337479792740982786,2020-12-11 19:30:06,"Dogs can be trained to detect Covid-19 by sniffing human sweat, according to a new proof-of-concept study https://t.co/fIJtTyUgJX"
1337477269925847041,2020-12-11 19:20:04,"Brandon Bernard was executed by the federal government at the Federal Correctional Center in Terre Haute, Indiana.… https://t.co/Dyj6OAsWUC"
1337474736075444227,2020-12-11 19:10:00,Time magazine has named Joe Biden and Kamala Harris 2020's Person of the Year https://t.co/SIAMRHlqm8
1337473494494404608,2020-12-11 19:05:04,A snow leopard at a Kentucky zoo has tested positive for Covid-19. It's the sixth animal species confirmed to have… https://t.co/KP8tsSkjLj
1337472234189975564,2020-12-11 19:00:04,JUST IN: The Senate has passed a one-week stopgap funding bill by voice vote to avert a government shutdown at midn… https://t.co/7E0vzznKGk
1337467628328267777,2020-12-11 18:41:46,The Senate has overwhelmingly approved a sweeping defense bill with a veto-proof majority — a major rebuke to Presi… https://t.co/sOtOhceWev
1337464698174894080,2020-12-11 18:30:07,"Sen. Dianne Feinstein, the 87-year-old California Democrat who has faced growing questions about her ability to do… https://t.co/OFx6N7JVHi"
1337462173119942656,2020-12-11 18:20:05,Investigators with the Manhattan district attorney's office have interviewed several employees at Trump's lender an… https://t.co/rembNL0sFk
1337459657191927814,2020-12-11 18:10:05,Ivanka Trump and Jared Kushner are currently in the final stages of purchasing a plot of land in an exclusive encla… https://t.co/F5NI4z1RWJ
1337457165385273347,2020-12-11 18:00:11,"If only we could all be as productive as Taylor Swift. But productivity looks different for everyone, especially du… https://t.co/EbmWcvoO6x"
1337454613176446977,2020-12-11 17:50:03,The company says her firing was unrelated to the pandemic. But advocates say her story speaks to a troubling nation… https://t.co/evJytaTJtw
1337452851455549441,2020-12-11 17:43:03,The British pound could plunge by 10% or more if the United Kingdom does not finalize a trade deal with the Europea… https://t.co/Z5HxZfBOQD
1337449603197792258,2020-12-11 17:30:08,"Indoor dining in New York City will close beginning Monday, Gov. Andrew Cuomo says. Outdoor dining and takeout can… https://t.co/tUz6u8sQ6y"
1337445889061908486,2020-12-11 17:15:23,"""Captain America"" star Chris Evans will voice ""the original Buzz Lightyear"" in a new Pixar film, ""Lightyear,"" the s… https://t.co/eP37Ho3BNd"
1337445883646971904,2020-12-11 17:15:21,"Two decades ago, Brazilian pianist João Carlos Martins lost the use of his hands.

He thought he’d never be able to… https://t.co/aOhvMNjHkE"
1337444557181517824,2020-12-11 17:10:05,"""I was at the hot chocolate station, and they said 'Go back to your beginning positions,'"" the 9-year-old told Insi… https://t.co/MSXmuDW6po"
1337442348880506888,2020-12-11 17:01:19,"Lloyds Bank has become the first UK lender to disclose the pay gap of its Black employees, shining a light on the d… https://t.co/Ni042xs6jj"
1337438631137566721,2020-12-11 16:46:32,"Some Black and Latino Americans are breathing a sigh of relief in the days since the election, according to a new s… https://t.co/pkmK9Uiwz2"
1337434516663771138,2020-12-11 16:30:11,"Disney+ announcements are an ""earth-shaking"" development in the streaming wars https://t.co/ceiILEDPKu https://t.co/MtPWCKGbTB"
1337431966724087815,2020-12-11 16:20:03,How to safely make it through the holiday season in the Covid-19 pandemic: https://t.co/Tnbeaizlf5 https://t.co/RBQcKW4h0B
1337429453308383233,2020-12-11 16:10:04,"There are ways to short-circuit feelings of panic and helplessness, even in a pandemic. Here are five expert-vetted… https://t.co/dZxEkxHiQt"
1337427016874942464,2020-12-11 16:00:23,"They have different politics, religions, incomes and ethnicities. But the one thing that unites them could happen t… https://t.co/FK7AuMzBwz"
1337421902428721157,2020-12-11 15:40:04,"The FDA has informed Pfizer it intends ""to proceed towards an authorization"" of the manufacturer's Covid-19 vaccine… https://t.co/JYSSkZOTzO"
1337420648101122049,2020-12-11 15:35:05,"""If presidential history is any indication, Trump courts political disaster by declaring his candidacy for 2024,"" T… https://t.co/m15A0Gv8gV"
1337419421321670662,2020-12-11 15:30:12,Europe is in meltdown again as daily Covid death tolls reach record highs and countries scramble to expand testing… https://t.co/OdKdlffWNh
1337417115440177158,2020-12-11 15:21:02,There's a possibility this Congress can end how it began: in a government shutdown. https://t.co/j8a1KiY07H
1337415868301668355,2020-12-11 15:16:05,"With the pandemic as a backdrop, more than 14 million American households are currently at risk of eviction and hav… https://t.co/Bx3Y2gAq5S"
1337414132203663362,2020-12-11 15:09:11,Wall Street analysts are projecting Pfizer and Moderna will generate $32 billion in Covid-19 vaccine revenue — next… https://t.co/yugNCwabnI
1337411886900514816,2020-12-11 15:00:16,"A massive exoplanet orbiting in a double star system 336 light-years away may be similar to the alleged ""Planet Nin… https://t.co/PiVvsPwhyA"
1337408318894125058,2020-12-11 14:46:05,"It's a traffic circle like no other, situated at a junction of sub-aquatic tunnels that connect the Faroe Islands a… https://t.co/QpkvVs3mqQ"
1337406295733919753,2020-12-11 14:38:03,"Two coronavirus vaccines are in line to be authorized for emergency use in the United States, and a massive transpo… https://t.co/xsYTWUzxxK"
1337405042387800064,2020-12-11 14:33:04,Two holes-in-one scored during first round of the US Women's Open https://t.co/9RFpaf1HFW https://t.co/Uu6AMeIgbR
1337403795110768640,2020-12-11 14:28:07,"Harrison Ford will be grabbing his whip and ramming on his hat for a fifth ""Indiana Jones"" movie, Disney has confir… https://t.co/7Hshcbtq3t"
1337402710568673287,2020-12-11 14:23:48,A vaccine won't single-handedly ensure Covid-19 doesn't cross international borders when travel picks up https://t.co/YY1oP58JE9
1337392983084298240,2020-12-11 13:45:09,"The FDA intends to proceed toward authorization of Pfizer's Covid-19 vaccine, HHS Secretary Alex Azar says. https://t.co/IEuOZYSV0d"
1337389205740281860,2020-12-11 13:30:08,"📩 Sign up to get the facts on coronavirus delivered to your inbox daily: https://t.co/S63YdMySKx

Here's everything… https://t.co/90Eq3ZZbPO"
1337385424910753792,2020-12-11 13:15:07,The Senate must pass a short-term government funding bill before midnight to avert a shutdown. But lawmakers have b… https://t.co/8KiwZOSdkM
1337381649269612544,2020-12-11 13:00:07,Facebook has been hit with twin lawsuits by the Federal Trade Commission and attorneys general from dozens of state… https://t.co/UdDyGXTsrQ
1337379631066980354,2020-12-11 12:52:06,What's next in the states' fight over the election at the Supreme Court https://t.co/3lCiWbznNY https://t.co/pfiSgU8WIW
1337377874467237889,2020-12-11 12:45:07,A Chinese national working in the Beijing bureau of Bloomberg News has been detained on suspicion of endangering na… https://t.co/vJPApkx43W
1337375361357795335,2020-12-11 12:35:08,Nearly a week after a sheriff's deputy fatally shot 23-year-old Casey Goodson Jr. as he was trying to enter his own… https://t.co/7EhESK4zho
1337367608136511489,2020-12-11 12:04:19,"Taylor Swift's second surprise album of 2020, ""Evermore,"" is here. https://t.co/KO9jhFAdR3 https://t.co/0eHySeSVF1"
1337362761706328065,2020-12-11 11:45:04,"Brandon Bernard was executed by the federal government at the Federal Correctional Center in Terre Haute, Indiana.… https://t.co/P8rfQboLBh"
1337359245382197248,2020-12-11 11:31:05,Congress stumbles on a Covid-19 aid package as vaccine approval passes a key hurdle | Analysis by @MaeveReston… https://t.co/XeDowiIM9m
1337355228287553536,2020-12-11 11:15:07,Emirates president Tim Clark says business travel could bounce back in 2022 https://t.co/vC3dUrG5b3 https://t.co/f0hehLAmSL
1337352290865385477,2020-12-11 11:03:27,"Kelp (a type of seaweed) is rich in protein and Vitamin B12, and it's good for the environment.

But it's still a n… https://t.co/L3wHSah3Nv"
1337351448909189120,2020-12-11 11:00:06,"Ellen DeGeneres says she has tested positive for Covid-19 and that she is ""feeling fine right now."" https://t.co/LXXJy3dZoX"
1337347145213599750,2020-12-11 10:43:00,"Hong Kong media tycoon Jimmy Lai was charged under a controversial national security law on Friday, police said, am… https://t.co/5tXTuBj6Gq"
1337343906204233731,2020-12-11 10:30:08,These five companies in Hong Kong's Wan Chai neighborhood all appear to exist for one reason: to evade the watchful… https://t.co/PEolhscPmO
1337340129334136834,2020-12-11 10:15:08,Washington's paralysis is deepening American inequality | Analysis by @zbyronwolf https://t.co/9kDjbUmWJm https://t.co/9H35SGjdnN
1337336362584985600,2020-12-11 10:00:10,"A surfer who was attacked by a shark in Hawaii on Tuesday has died, prompting the suspension a women's professional… https://t.co/LxVN1xLiEV"
1337332568262369280,2020-12-11 09:45:05,The legacy of the character Black Panther will continue on -- but not with someone new in the iconic role. https://t.co/uhnzibI5ou
1337328796308004865,2020-12-11 09:30:06,A Florida business owner who was once down on his luck is giving back by covering the utility bills of 114 families… https://t.co/SobzrhEcyt
1337325765797490688,2020-12-11 09:18:03,The acting director of Immigration and Customs Enforcement is stepping down at the end of the month after a brief t… https://t.co/J8i94EWbh1
1337321275660890113,2020-12-11 09:00:13,The US is a step closer to a Covid-19 vaccine authorization. But that's unlikely to impact the dark and deadly days… https://t.co/x7s8xQl6BT
1337317471821451265,2020-12-11 08:45:06,An Australian produced coronavirus vaccine candidate has been scrapped after trial participants returned false posi… https://t.co/tQhqWhxskk
1337313701377011712,2020-12-11 08:30:07,Chinese tech companies bet big on India. Now they're being shut out | Analysis by @Sherisse https://t.co/qzCk6EHBAx https://t.co/cQMG7L191S
1337310176156782594,2020-12-11 08:16:06,Congress stumbles on a Covid-19 aid package as vaccine approval passes a key hurdle | Analysis by @MaeveReston… https://t.co/eCg1Yrep1Q
1337306167136161793,2020-12-11 08:00:10,A Chinese citizen who allegedly financed a turtle-trafficking ring has been extradited from Malaysia to the United… https://t.co/gEjIDE6nr7
1337302517512888323,2020-12-11 07:45:40,"Brandon Bernard was executed by the federal government at the Federal Correctional Center in Terre Haute, Indiana.… https://t.co/l7VtvLUY5P"
1337298330389520386,2020-12-11 07:29:02,Bansky has confirmed that he is behind an artwork depicting an old woman violently sneezing as her dentures fly int… https://t.co/ZhnHGdRB6R
1337295063433568256,2020-12-11 07:16:03,Time magazine has named Joe Biden and Kamala Harris 2020's Person of the Year https://t.co/Ei2WHfvnaB
1337291299041533953,2020-12-11 07:01:06,Scientists working off the western coast of Mexico say they have found a previously unknown species of whale… https://t.co/4btKVwwYkj
1337283757624225793,2020-12-11 06:31:08,Conservation Canines trains dogs that help scientists find and track endangered animals to help save them. These in… https://t.co/YkwGjyUwPY
1337268648948457473,2020-12-11 05:31:05,"Dogs can be trained to detect Covid-19 by sniffing human sweat, according to a new proof-of-concept study https://t.co/OzcR7aptkT"
1337264297462943745,2020-12-11 05:13:48,"Brandon Bernard was executed by the federal government at the Federal Correctional Center in Indiana, according to… https://t.co/IFimNlvI71"
1337261106184806400,2020-12-11 05:01:07,"Covid-19 can lead to neurological complications, including strokes, seizures and movement disorders, researchers ha… https://t.co/X9ktl7aYwi"
1337257333739708416,2020-12-11 04:46:08,"Michigan Attorney General Dana Nessel rebukes Texas’ lawsuit to invalidate millions of votes.

“It’s outrageous tha… https://t.co/77fbiUUHVi"
1337254532745547779,2020-12-11 04:35:00,"""We as a nation need to continue to wear the mask, to keep the physical distance, to avoid crowds. We're not throug… https://t.co/uIkH1p7DqL"
1337252420091580417,2020-12-11 04:26:36,Time magazine has named Joe Biden and Kamala Harris 2020's Person of the Year https://t.co/2rxWhGRa9m
1337252015974445056,2020-12-11 04:25:00,"""We have a very high baseline of infections, over 200,000 a day... you superimpose upon that the colder weather whi… https://t.co/iwXiHWDvr5"
1337249777092845568,2020-12-11 04:16:06,"Trevor Potter, former chairman of the Federal Election Commission, calls the Supreme Court lawsuit from Texas “very… https://t.co/CyinmEamkH"
1337249751146901504,2020-12-11 04:16:00,"""When wars come about we have trillions of dollars to spend... but when it comes to the children of this country go… https://t.co/mLzvfqxnTy"
1337246983061262336,2020-12-11 04:05:00,"Dr. Archana Chatterjee, a member of the FDA panel who voted against the recommendation to authorize the Pfizer Covi… https://t.co/vcXOJKrAU2"
1337245190722101254,2020-12-11 03:57:52,Inclusion is evolving. Nowhere is this truer than in Hollywood. | Analysis by @LisaFranceCNN… https://t.co/HtMHBADG4l
1337244466198044673,2020-12-11 03:55:00,"“The Republicans have in many ways weaponized police reform policies,” says Democratic Rep. Barbara Lee, reacting t… https://t.co/HLOqIWuGa0"
1337241949959548934,2020-12-11 03:45:00,“We’re all going to sleep a lot better once we start vaccinating people in our nursing homes as well as our first r… https://t.co/QGMetwaiD7
1337241376942133251,2020-12-11 03:42:43,NYT columnist Thomas Friedman says the more than 100 House Republicans backing a lawsuit from Texas seeking to over… https://t.co/zi2SgsHfmt
1337239433410732034,2020-12-11 03:35:00,CNN’s @WolfBlitzer speaks with three members of the FDA panel that recommended the emergency use authorization of P… https://t.co/kFKj4l162g
1337239395901067264,2020-12-11 03:34:51,"""President-elect Joe Biden has said he will prioritize immigration reform from the first day of his administration.… https://t.co/EoSiii31Ou"
1337238020441788418,2020-12-11 03:29:23,"RT @AC360: ""He is now all in on what he's billing as 'The Big One,' a Supreme Court challenge led by Texas, pitting state against state, no…"
1337236245005692931,2020-12-11 03:22:20,A Florida business owner who was once down on his luck is giving back by covering the utility bills of 114 families… https://t.co/ly71JjfKAU
1337236191117148160,2020-12-11 03:22:07,"“It is a day that’s really worth celebrating,” says Dr. Sanjay Gupta of the FDA panel recommending the authorizatio… https://t.co/ZneU6SJsJc"
1337235828506939396,2020-12-11 03:20:40,"As with masks, experts say that for the new Covid-19 vaccines to control the virus, a lot of people have to use the… https://t.co/i0YaQrq0J0"
1337235194084921344,2020-12-11 03:18:09,"“I think once people see more people getting vaccinated with this vaccine, they [will] see that it's safe” and gain… https://t.co/hNKrcU8Vel"
1337234340762144769,2020-12-11 03:14:46,"""When we started the food pantry a couple years ago it was only for 60 families... since the pandemic, it's jumped… https://t.co/dgVAY6vgyB"
1337232661052612610,2020-12-11 03:08:05,New footage of Florida officers entering the home of a former Covid data scientist shows a testy confrontation and… https://t.co/OzcH4PmALJ
1337230611065540609,2020-12-11 02:59:56,"Iranian-backed militias in Iraq have moved to a ""heightened level of preparation"" in recent days, raising fresh con… https://t.co/DhPfx1otZn"
1337227992553168897,2020-12-11 02:49:32,"""While all signs suggest Trump's attempts to overturn the election will falter, the country may not survive another… https://t.co/p6S3YcuWMy"
1337225627473162242,2020-12-11 02:40:08,"Senate leaders are trying to resolve last-minute objections to two must-pass bills, which could trigger a brief gov… https://t.co/6HaJFzYVXy"
1337224556042473472,2020-12-11 02:35:53,"In late summer and fall, hundreds of white sharks congregate in Monterey Bay, California - so scientists take the c… https://t.co/r4SV3xibSv"
1337224539361710083,2020-12-11 02:35:49,"""Next year can be the tipping point for global progress on climate change. ... A Biden White House with Kerry as cl… https://t.co/rIsnSqxygw"
1337220073740791808,2020-12-11 02:18:04,"Boston College's football team will opt out of any opportunity to play in a bowl game, officials say, marking the l… https://t.co/NyY27XQU1d"
1337217053435043846,2020-12-11 02:06:04,"New Hampshire Speaker of the House Richard ""Dick"" Hinch has died from Covid-19, the state attorney general's office… https://t.co/68pzXQHqE2"
1337213166829375489,2020-12-11 01:50:37,The city council of a small Minnesota town has allowed a Whites-only religious organization to use a vacant church https://t.co/43MTWzzwy3
1337209506602872832,2020-12-11 01:36:05,CNN's Brynn Gingras writes about her experience having a recent miscarriage and expresses gratitude to women — frie… https://t.co/0ob99SbiHF
1337207834673639425,2020-12-11 01:29:26,Smugglers managed to throw a hefty haul of contraband items — including 20 pounds of tobacco and 7 pounds of barbec… https://t.co/Prrfz745ck
1337205772699111425,2020-12-11 01:21:14,"Pennsylvania called Texas' lawsuit at the Supreme Court to throw out millions of ballots a ""seditious abuse of the… https://t.co/aj5P6mJVdW"
1337205307840270337,2020-12-11 01:19:24,"""Dancing With the Stars"" judge Carrie Ann Inaba says she has tested positive for Covid-19 https://t.co/zu8Jf9hah5"
1337200937769832452,2020-12-11 01:02:02,President Trump filed a brief at the Supreme Court that featured some of the same false and misleading claims Trump… https://t.co/jkbywfW0Qr
1337198501411909632,2020-12-11 00:52:21,The four battleground states targeted by a Texas lawsuit seeking to overturn President Trump's election defeat issu… https://t.co/V3febdTUch
1337195881435713537,2020-12-11 00:41:56,President-elect Joe Biden expressed skepticism about his powers to implement his agenda by executive action Tuesday… https://t.co/pxJDwsUSoS
1337192333050339328,2020-12-11 00:27:50,"A co-founder of Black Lives Matter was joined by Alicia Keys, Kerry Washington, Greta Thunberg and others in an ope… https://t.co/TNDSxsvUg3"
1337188653077061632,2020-12-11 00:13:13,"SpaceX's massive steel rocket prototype, an early iteration of the technology CEO Elon Musk hopes will be used to p… https://t.co/EVRjuQgwiI"
1337185965832593409,2020-12-11 00:02:32,"As with masks, experts say that for the new Covid-19 vaccines to control the virus, a lot of people have to use the… https://t.co/6imkJeok5s"
1337182357988765696,2020-12-10 23:48:12,"A one-off video for Disney fans turned into one of TikTok's most successful trends. Now, ""Ratatouille: A TikTok Mus… https://t.co/ygo1uqy5XT"
1337177841524498438,2020-12-10 23:30:15,"It’s a club you never want to join. @LisaLing meets people from different walks of life, brought together by gun vi… https://t.co/vvK5Ia4UEa"
1337177184767717377,2020-12-10 23:27:39,The groundbreaking lawsuits filed against Facebook by state and federal officials represent the gravest regulatory… https://t.co/eTzVjmBiZA
1337168958512836608,2020-12-10 22:54:57,JUST IN: FDA advisers vote to recommend that the agency grant emergency use authorization to Pfizer and BioNTech's… https://t.co/GJhHvi9uco
1337168573492572160,2020-12-10 22:53:25,"Time magazine has announced its four finalists for ""Person of the Year."" President Trump is one of them, and the ot… https://t.co/TShSQQRdQz"
1337165930925797377,2020-12-10 22:42:55,"President-elect Joe Biden's goal is to have his remaining Cabinet selections announced before Christmas, a transiti… https://t.co/30YoXv2sDi"
1337161439832891393,2020-12-10 22:25:05,"""Spin aside, it's worth asking the question: How much trouble could Hunter Biden actually be in? The short answer i… https://t.co/KeKGb74Mtn"
1337156854779179017,2020-12-10 22:06:52,"Last year, Disney debuted Disney+ at an investor event on its famed studio lot.

That service has grown into the fo… https://t.co/2dJJptUkI7"
1337153889334829056,2020-12-10 21:55:04,"A host of stores like Gap, Nordstrom, Vera Bradley and others have incorporated 2020's must-have accessory into the… https://t.co/rceBxuOGTj"
1337149428579315712,2020-12-10 21:37:21,"Texas Attorney General Ken Paxton, who has fought in the courts for President Trump's causes before, has emerged as… https://t.co/CHqKCkFwMa"
1337144255735869451,2020-12-10 21:16:48,"Ben &amp; Jerry's has unveiled a new Colin Kaepernick-inspired vegan ice cream called ""Change the Whirled"" https://t.co/jlYFk4BUUf"
1337140299726983168,2020-12-10 21:01:04,"Like President Trump, his associates have received drugs that aren't yet widely available to the American public as… https://t.co/vqc8X2MBBC"
1337137781685051393,2020-12-10 20:51:04,"Texas Attorney General Ken Paxton, who has fought in the courts for President Trump's causes before, has emerged as… https://t.co/Uf0AiOlYAc"
1337135267099144212,2020-12-10 20:41:05,"Lewis Hamilton will race at Sunday's Abu Dhabi Grand Prix after testing negative for coronavirus, Mercedes has conf… https://t.co/JTnDfZqH6h"
1337132745261244418,2020-12-10 20:31:03,"Douglas Emhoff, Vice President-elect Kamala Harris' husband, will become a member of Georgetown Law Faculty in Janu… https://t.co/vH1Fd0S1TF"
1337129994083037184,2020-12-10 20:20:07,"""Small businesses are about to hit a dead end -- if they haven't already -- and they need help. Main Street needs f… https://t.co/WRWGcGgMQA"
1337127459188338735,2020-12-10 20:10:03,"Child abuse visits to the emergency room dropped during the early days of the pandemic, according to a new CDC anal… https://t.co/KhNt2s9lKW"
1337124969201987584,2020-12-10 20:00:09,"Dr. Anthony Fauci, the nation's top infectious disease expert, stressed that the upcoming Covid-19 vaccines are saf… https://t.co/l1uCDd7yGV"
1337122435519406080,2020-12-10 19:50:05,"Harumichi Shibasaki, sometimes referred to as the ""Bob Ross of Japan,"" has become a social media sensation during t… https://t.co/CBhzuaanHC"
1337119911550869505,2020-12-10 19:40:04,"While the economic crisis brought on by the pandemic has ravaged communities around the world, the concept of a gua… https://t.co/FO83abaYoZ"
1337118665125322754,2020-12-10 19:35:06,"A forecast published by the CDC projects there will be 332,000 to 362,000 coronavirus deaths in the US by January 2… https://t.co/m9O7xlap5V"
1337117420486602756,2020-12-10 19:30:10,"A memorial dedicated to Anne Frank in Boise, Idaho, was desecrated with stickers showing swastikas. https://t.co/KPF4xi5IPZ"
1337116152082870272,2020-12-10 19:25:07,Los Angeles Lakers star LeBron James has been named TIME magazine's Athlete of the Year https://t.co/y75irUINCy https://t.co/Dv6vzZUi2n
1337114878788694025,2020-12-10 19:20:04,With a global pandemic raging — and an outgoing President whose orbit is rife with people shunning public health gu… https://t.co/jg8b6SmoFk
1337113629758550028,2020-12-10 19:15:06,"The idea for the song ""A Spoonful of Sugar"" from the 1964 Disney film ""Mary Poppins"" actually came from a conversat… https://t.co/rGg0WGslvK"
1337112361975549959,2020-12-10 19:10:04,SCOTUS has ruled 8-0 that the military can prosecute at any time sexual assault cases committed between 1986 and 20… https://t.co/dO8wNk3gb6
1337111100052152320,2020-12-10 19:05:03,Three Muslim men who had been placed on no-fly lists are allowed to sue for financial damages against FBI officials… https://t.co/QqSiZ2G0d6
1337108871165435907,2020-12-10 18:56:11,"A British fossil hunter has found a previously unidentified ""sea dragon"" on the southern English coast https://t.co/hDuB0kcPOA"
