id,created_at,text
1335094325559037955,2020-12-05 05:31:06,"Sports jerseys from Michael Jordan, Colin Kaepernick, and even a former president all set world records this week d… https://t.co/qgb7gMZAOF"
1335086553513734146,2020-12-05 05:00:13,"""A psychologist told my parents I had a low IQ because I was born with Down syndrome. Seven years later, I graduate… https://t.co/RM75HGFRit"
1335084483599536128,2020-12-05 04:52:00,"A son penned an obituary for his father, who died of Covid-19, criticizing those who ""refuse to wear a piece of clo… https://t.co/nSEAc6vwOY"
1335082994177089538,2020-12-05 04:46:05,"Pharrell Williams is not only a Grammy award-winning artist and producer, but he is also quite the entrepreneur. An… https://t.co/1wmMgivkBo"
1335082993875030016,2020-12-05 04:46:05,The Kentucky Prosecutors Advisory Council declined to appoint a special prosecutor in the case of Breonna Taylor's… https://t.co/ukbY1hvfGZ
1335079212286406657,2020-12-05 04:31:03,"There's so much we've missed during the lost year of Covid, @secupp writes for @CNNOpinion, and though they may fee… https://t.co/YwTh6VBX1B"
1335075441309257729,2020-12-05 04:16:04,"The Trump campaign and its allies were dealt additional blows in Michigan, Nevada, Wisconsin and Arizona on Friday… https://t.co/Iwa61TlaPs"
1335071674392342528,2020-12-05 04:01:06,The Department of Defense is set to receive the coronavirus vaccine directly from the companies that manufacture it… https://t.co/qzqcm7zR4H
1335067887812423688,2020-12-05 03:46:03,"""President-elect Joe Biden knows the challenges and the opportunities of the vice presidency better than any incomi… https://t.co/iosiLyTBgy"
1335064871323328512,2020-12-05 03:34:04,"""My muscles hurt, my joints hurt...I told [my husband]...either I got the real vaccine or I'm highly suggestible.""… https://t.co/qLNq53ZNrT"
1335060340049108992,2020-12-05 03:16:03,White House staffers at all levels are plotting their departures as a growing number of aides to President Trump ar… https://t.co/l2scEyAvUH
1335058528185139200,2020-12-05 03:08:51,"""Both of the vaccines... are what's called a prime-boost,"" says Dr. Anthony Fauci of the Moderna and Pfizer vaccine… https://t.co/Wylv9rzYQM"
1335055240396111873,2020-12-05 02:55:48,"When a Covid-19 vaccine is approved and ready for distribution, where will it be administered?

""CVS, Walgreens, do… https://t.co/DRJhCpTOpP"
1335052699809640453,2020-12-05 02:45:42,"Dr. Saju Mathew says that the only way back to normalcy “is to forget about Christmas this year, is to forget about… https://t.co/QSDY7REisx"
1335052610961690624,2020-12-05 02:45:21,"Dr. Geeta Nayyar says that while celebrities and leaders can help display the safety of a vaccine, “let’s also not… https://t.co/xurPkoIBaE"
1335052403935043584,2020-12-05 02:44:31,RT @TheLeadCNN: President-elect Joe Biden says his team has not seen a detailed plan from the Trump administration on getting a vaccine to…
1335051736239759360,2020-12-05 02:41:52,The Trump administration prevented President-elect Joe Biden's transition team from meeting with its counterparts a… https://t.co/tcYs5wsuWn
1335049771590017025,2020-12-05 02:34:04,"The US government won't extend the deadline for TikTok's Chinese parent to sell off the app, but it will also decli… https://t.co/qql5GSQklp"
1335047612563484672,2020-12-05 02:25:29,"RT @AC360: ""I just hope that as Democrats across Georgia we have enough discipline not to just wait for the Republican party to self-implod…"
1335047350524456960,2020-12-05 02:24:27,"For weeks, experts have warned Americans in increasingly dire terms that this winter will be one of the darkest per… https://t.co/ySjaHH5CpQ"
1335044379451543552,2020-12-05 02:12:38,"""I would like to say vaccines do not equal zero Covid,"" said Dr. Michael Ryan, the executive director of WHO's Heal… https://t.co/RiucvQAD8o"
1335041684237848576,2020-12-05 02:01:56,Dr. Anthony Fauci joins Anderson Cooper and Dr. Sanjay Gupta to answer your questions about coronavirus vaccines.… https://t.co/iyRzuUemrh
1335041471184072708,2020-12-05 02:01:05,The 2021 National Defense Authorization Act — annual legislation that sets funding priorities and policies for Depa… https://t.co/3kCzQDfN6A
1335037495332003841,2020-12-05 01:45:17,Former top cybersecurity official Chris Krebs has sent a clear message to President Trump: Stop attacking the integ… https://t.co/GAtNhfSSyM
1335033702716465152,2020-12-05 01:30:13,Dr. Anthony Fauci joins Anderson Cooper and Dr. Sanjay Gupta to answer your questions about coronavirus vaccines. C… https://t.co/g2DB3TmoOv
1335033648878325760,2020-12-05 01:30:00,What questions do you have about coronavirus vaccines? Tweet your questions with #CNNTownHall and we will feature s… https://t.co/Oc1pSu4Qn9
1335033360608071682,2020-12-05 01:28:51,A South Texas high school football player was charged with assault after rushing from the sideline and knocking a r… https://t.co/gr1GVlm2Tb
1335031496231559169,2020-12-05 01:21:27,"President Trump has ordered the majority of US troops to leave Somalia ""by early 2021,"" in just the latest major mi… https://t.co/8RLRrxye6l"
1335028891275186176,2020-12-05 01:11:05,The Trump administration must post a public notice that it will accept new applications for the Obama-era program s… https://t.co/Fd56fCltPP
1335027625249697794,2020-12-05 01:06:04,"Six San Francisco Bay Area governments have issued a stay-at-home order ahead of California's statewide mandate, re… https://t.co/PTCKQ5z1Kj"
1335026907516203008,2020-12-05 01:03:13,President Trump is increasingly isolated in his claims of election fraud as a growing number of senior administrati… https://t.co/E8CALcYfoe
1335026426765078530,2020-12-05 01:01:18,There are growing calls for Secretary of State Mike Pompeo to cancel a number of planned in-person holiday events a… https://t.co/p1et6474Rw
1335023437941772288,2020-12-05 00:49:25,"Republicans are relying on an enthusiastic base in places like Haralson County, Georgia, to vote for incumbent Repu… https://t.co/jHRm3hy6EY"
1335021033716379650,2020-12-05 00:39:52,China wants to break the US dollar's stranglehold on the global financial system and gain greater control over how… https://t.co/duawSXlkVV
1335019473280118785,2020-12-05 00:33:40,People with student loans will get another month of relief after Education Secretary Betsy DeVos extended the pause… https://t.co/HDwKMMnq8n
1335019198360080386,2020-12-05 00:32:35,New Jersey Gov. Phil Murphy says federal money is needed to distribute potentially millions of vaccine doses in his… https://t.co/xTRrBVoTgf
1335014947764531200,2020-12-05 00:15:41,"Masks are ""critical"" to controlling the spread of coronavirus, and that includes at home sometimes, the US Centers… https://t.co/Nl764a1HKv"
1335010271954341888,2020-12-04 23:57:06,"Don't expect to hear of ""murder hornets"" or nests being captured in the coming months.

The Washington State Depart… https://t.co/kxitVSc64p"
1335003458072506368,2020-12-04 23:30:02,What questions do you have about coronavirus vaccines? Tweet your questions with #CNNTownHall and we will feature s… https://t.co/iosWR0SovU
1334999724382965760,2020-12-04 23:15:12,"The DOJ bribery-for-a-presidential-pardon investigation, which became public this week, involves the past efforts o… https://t.co/dlctkAtn8m"
1334997279284092928,2020-12-04 23:05:29,Former top cybersecurity official Chris Krebs on threats against election officials: “These are public servants. Th… https://t.co/scYeobSvLY
1334996983019433984,2020-12-04 23:04:18,"Former top cybersecurity official Chris Krebs says he would tell President Trump to “defend democracy.”

“There are… https://t.co/DIfpwhTF9W"
1334996299096141825,2020-12-04 23:01:35,"With its million-dollar homes and manicured lawns, Greenwich, Connecticut, has long been a serene enclave that vete… https://t.co/0accPIGjJE"
1334996169517314049,2020-12-04 23:01:04,"""The evidence is in, and Trump is far from a once-in-a-generation political talent. Just the opposite: he is a pola… https://t.co/1ncdIQOnXJ"
1334992894420164608,2020-12-04 22:48:03,"RT @TheLeadCNN: According to two sources, during a recent phone call, Trump blasted Georgia Republican Gov. Brian Kemp as a ""moron"" and ""nu…"
1334992325517463554,2020-12-04 22:45:48,President Trump has purged a Pentagon business advisory board and replaced its members with his former campaign man… https://t.co/IAFX3gFGLI
1334992126850064384,2020-12-04 22:45:00,President-elect Joe Biden said the Trump administration had shared information with his transition team about distr… https://t.co/OAHyl9mzL8
1334991487306784771,2020-12-04 22:42:28,"California AG Xavier Becerra has emerged as a key contender to lead the Department of Health and Human Services, so… https://t.co/jP6HcJYVRC"
1334989469020278787,2020-12-04 22:34:26,Trump's Georgia visit Saturday comes as he has spent the last several weeks consumed by his own election loss while… https://t.co/xLYx98GESB
1334982490079911936,2020-12-04 22:06:43,What questions do you have about coronavirus vaccines? Tweet your questions with #CNNTownHall and we will feature s… https://t.co/kjKkXUWULe
1334980539636461576,2020-12-04 21:58:58,The Supreme Court has agreed to review whether the Trump administration can allow states to impose work requirement… https://t.co/rOKHUX0w1W
1334979520848420865,2020-12-04 21:54:55,"Pharrell Williams and Jay-Z's song ""Entrepreneur"" opens with the lyric, ""I am black ambition."" Williams continues t… https://t.co/A4N9AO8n1Q"
1334971983281393665,2020-12-04 21:24:58,The House of Representatives has passed a bipartisan bill that would ban private ownership of big cats like lions a… https://t.co/f7pT15vHZi
1334965989692346369,2020-12-04 21:01:09,Slightly more than half of US adults — 54% — now say that they know someone who has been hospitalized or died due t… https://t.co/4X1TalrlC5
1334963447503736837,2020-12-04 20:51:02,"Bethany Moultry and her mother came up with the idea to create care packages to give to the homeless.

But when Cov… https://t.co/h3DIhrB2St"
1334960927825911808,2020-12-04 20:41:02,The Department of Health and Human Services plans to spend $250 million on a national education campaign to promote… https://t.co/NhJ0TTqo47
1334958423197278208,2020-12-04 20:31:05,State Department officials who work with Secretary of State Mike Pompeo have told the department's career transitio… https://t.co/G0xS3FzsEY
1334955897387409408,2020-12-04 20:21:02,"More than 1,000 migrant children in US government custody have tested positive for coronavirus since March, accordi… https://t.co/T4kvZY9834"
1334953133294968838,2020-12-04 20:10:03,NASA pledged in September to buy moon rocks from companies that can get robotic rovers to the lunar surface and sco… https://t.co/rM1fPZ93wX
1334950719686905856,2020-12-04 20:00:28,What is it like to have the second most powerful job in the world? All six living Vice Presidents give you the insi… https://t.co/zvdk7A1SG3
1334948094509772803,2020-12-04 19:50:02,President-elect Joe Biden's margin over President Trump in the nationwide popular vote is now more than 7 million v… https://t.co/yu0kVAZYiH
1334945598219366401,2020-12-04 19:40:07,A Jewish doctor who treated a patient with Nazi tattoos says the pandemic has tested his compassion https://t.co/0qRV2wEBPQ
1334943073399427072,2020-12-04 19:30:05,"Covid-19 is the leading cause of death in the US this week, according to the Institute for Health Metrics and Evalu… https://t.co/bS2AdEDIz1"
1334940555902640131,2020-12-04 19:20:05,"The Cheesecake Factory has agreed to pay a fine of $125,000 to settle Securities and Exchange Commission charges of… https://t.co/M1RsGZf7cG"
1334938056701435905,2020-12-04 19:10:09,"""The Lord of the Rings"" cast is crowdfunding to buy J.R.R. Tolkien's home in Oxford, England, and turn it into a li… https://t.co/ERwFqK7mXQ"
1334936010157920257,2020-12-04 19:02:01,JUST IN: The House of Representatives has passed legislation that would decriminalize marijuana and seek to “addres… https://t.co/CRxZbFr0EQ
1334930491858968579,2020-12-04 18:40:05,"""Mariah Carey's Magical Christmas Special"" is here and it's everything you dreamed it would be https://t.co/aHGg0yfmWb"
1334927981161181184,2020-12-04 18:30:07,"An Indian schoolteacher, awarded the 2020 Global Teacher Prize for his efforts to promote girls' education at his s… https://t.co/cK183i4bBJ"
1334925880322306051,2020-12-04 18:21:46,"The first commercially printed Christmas card is up for sale, depicting a merry scene that scandalized some of 19th… https://t.co/EJIPOAg6og"
1334923459344863235,2020-12-04 18:12:09,"The House of Representatives is poised to pass legislation that would decriminalize marijuana and seek to ""address… https://t.co/5eoEMMQa1B"
1334920440469458953,2020-12-04 18:00:09,"President-elect Joe Biden calls the November jobs report ""grim"" and says any stimulus passed before the next sessio… https://t.co/j33gbSvBwZ"
1334918576243941383,2020-12-04 17:52:44,"""Avgeek"" fans of the queen of the skies can book a farewell day on a Virgin Atlantic 747 jumbo jet — complete with… https://t.co/GXKMRPU4nD"
1334915369241178114,2020-12-04 17:40:00,"Riley Behrens, a 23-year-old rugby player, suffered a ministroke stemming from Covid-19 complications.

“I thought… https://t.co/i73vI9DBTi"
1334913349709131785,2020-12-04 17:31:58,"""The job market recovery is at risk of stalling out as the pandemic intensifies,"" Matt Egan writes. ""The rapid loss… https://t.co/BPw3WGTzZl"
1334910360604782593,2020-12-04 17:20:06,"The pediatric formulation of dolutegravir, a drug WHO recommends as first-line HIV treatment, will come as a strawb… https://t.co/fRWYgXLDou"
1334909112329580544,2020-12-04 17:15:08,"Queen Elizabeth II's dorgi Vulcan is reported to have died at Windsor Castle, leaving the British monarch with just… https://t.co/2tCAUevkTm"
1334909105836789760,2020-12-04 17:15:06,"When it comes to opioid addiction, one state is moving towards a more sympathetic approach. @LisaLing learns how th… https://t.co/CMXHYUFzH2"
1334907727122927623,2020-12-04 17:09:38,"""Cannabis reform is a critical and urgent matter of racial justice,"" Reps. Earl Blumenauer and Barbara Lee  write f… https://t.co/SybenNdjKc"
1334900312906346501,2020-12-04 16:40:10,A United Nations commission has voted to remove cannabis from a list that categorized it as one of the most dangero… https://t.co/N75HztlBjz
1334897782637948929,2020-12-04 16:30:07,The two largest planets in our solar system are coming closer together than they have been since the Middle Ages https://t.co/nrzLJdPQIV
1334895278562959363,2020-12-04 16:20:10,"""Just 100 days to mask, not forever. 100 days. And I think we'll see a significant reduction,"" said President-elect… https://t.co/DuYXmFoXB4"
1334894001074417664,2020-12-04 16:15:05,"Former Presidents Barack Obama, George W. Bush and Bill Clinton are volunteering to get their Covid-19 vaccines on… https://t.co/9UoHuK4uMn"
1334892405041094657,2020-12-04 16:08:45,"Even though four more states — Arizona, Montana, New Jersey and South Dakota — legalizing recreational weed at the… https://t.co/M302ILE2xy"
1334890580405592065,2020-12-04 16:01:30,"The US economy added 245,000 jobs in November on a seasonally adjusted basis, according to the Bureau of Labor Stat… https://t.co/dGG7on4jJe"
1334889064848297984,2020-12-04 15:55:28,A historic Tenessee power plant has been imploded to clear the land for new development https://t.co/bKHNSRsq3F https://t.co/IunVO3ZP0H
1334886891410296834,2020-12-04 15:46:50,President-elect Joe Biden's margin over President Trump in the nationwide popular vote is now more than 7 million v… https://t.co/V17QI6wvKL
1334885445973454850,2020-12-04 15:41:05,"The use of cash has been declining for years in Britain, but the demand for banknotes is skyrocketing. Nobody is qu… https://t.co/M1KcyMHfzR"
1334884400492933120,2020-12-04 15:36:56,Residents of a community in central Germany have unexpectedly inherited property and a stock portfolio worth €6.2 m… https://t.co/z1HKSQqWT9
1334882862181584898,2020-12-04 15:30:49,A Jewish doctor who treated a patient with Nazi tattoos says the pandemic has tested his compassion https://t.co/Wz3NqjpqQP
1334878461673017344,2020-12-04 15:13:20,Dr. Anthony Fauci’s comments Wednesday were the opening salvo in a verbal jousting match between US and UK official… https://t.co/zsf50desyy
1334877142283390976,2020-12-04 15:08:06,"“One by one, the corners of the safety net are being cut.” 

@ChristineRomans talks about expiring programs and ben… https://t.co/GMAe4soBei"
1334876109612126216,2020-12-04 15:03:59,"A suspect is dead after a confrontation in the Bronx in which two US marshals were shot and wounded, law enforcemen… https://t.co/ePARz1NXSJ"
1334874196996993024,2020-12-04 14:56:23,"Covid-19 is the leading cause of death in the US this week, according to the Institute for Health Metrics and Evalu… https://t.co/eS2JXjJICr"
1334867835491905539,2020-12-04 14:31:07,"RT @CNNBusiness: ""I think the DNA we've created for the show transcends whoever is president. It was certainly forged in the Trump area."" M…"
1334862549414719489,2020-12-04 14:10:06,Enrollment has fallen at schools across the country as virtual tuition takes a toll. That could spell future financ… https://t.co/oh7JWQrKrO
1334860064281268225,2020-12-04 14:00:14,Dr. Anthony Fauci joins Anderson Cooper and Dr. Sanjay Gupta to answer your questions about coronavirus vaccines. C… https://t.co/h6ApI5K8BH
1334856259456131078,2020-12-04 13:45:07,"JUST IN: The US economy added 245,000 jobs last month — 224,000 fewer than economists had expected. The unemploymen… https://t.co/O1hQ06bdqD"
1334854245967945728,2020-12-04 13:37:07,A rapidly intensifying nor'easter may deliver heavy rain and strong winds from Washington to Maine. Four Northeaste… https://t.co/qIRI0WuQLD
1334852475405406211,2020-12-04 13:30:05,Dr. Anthony Fauci has apologized for his apparent criticism of British regulators who have authorized the Pfizer va… https://t.co/V9NvspXsRj
1334849780850241540,2020-12-04 13:19:22,"This funeral home in northern Illinois receives about 30 service requests a month. In November, it received about 5… https://t.co/gilZaEtdna"
1334841153838047237,2020-12-04 12:45:05,Political questions from Democrats and a new Republican litmus test have suddenly become complicating factors in on… https://t.co/FHrQTLPRMT
1334837404964941826,2020-12-04 12:30:12,"An influential University of Washington model projects that nearly 539,000 Americans could die from coronavirus by… https://t.co/XmRvhoIvyu"
1334833600307531779,2020-12-04 12:15:04,When a local health officer informed Maryland authorities that a young boy who was about to board a plane had teste… https://t.co/cfafHNwsIS
1334831587079446528,2020-12-04 12:07:04,"To some epidemiologists, establishing cutoff times for bars and restaurants ignores the fact that Covid-19 does not… https://t.co/msUznT3t4X"
1334829841049325568,2020-12-04 12:00:08,"Astronauts are harvesting fresh radishes grown in space, a delicious prospect that also could help seed food produc… https://t.co/MTTdaNibQd"
1334826989279191040,2020-12-04 11:48:48,"The best present you can give your family is to stay home for the holidays, according to CNN Medical Analyst Dr. Le… https://t.co/4503uDDeOF"
1334817741795176449,2020-12-04 11:12:04,"The CDC Director has warned Americans that the next three months are going to be ""the most difficult in the public… https://t.co/7Aea5HZFAM"
1334814986020003840,2020-12-04 11:01:06,"Carnival Cruise Line has announced that it has canceled its remaining cruises through February 2021, as Covid-19 ca… https://t.co/EJVwexlOWR"
1334812199873818625,2020-12-04 10:50:02,"""Just 100 days to mask, not forever. 100 days. And I think we'll see a significant reduction,"" said President-elect… https://t.co/pzAisgZoXS"
1334810948423602176,2020-12-04 10:45:04,One race in Georgia will decide control of the Senate. Reverend Raphael Warnock and Senator Kelly Loeffler together… https://t.co/R6qykpyNhp
1334808281156636673,2020-12-04 10:34:28,"With all that's happened in 2020, you could be forgiven for forgetting about Brexit. But it's heating up again. CNN… https://t.co/aWPsQW3dud"
1334803600166543360,2020-12-04 10:15:52,What Biden gets about being president that Trump doesn't | @errollouis for @cnnopinion https://t.co/zxessJF7x3
1334788052036759557,2020-12-04 09:14:05,"""This hasn't been the focus of his rhetoric apparently and I think it's a great human tragedy,"" says Sen. Mitt Romn… https://t.co/iSRxeOPBDV"
1334786287052726272,2020-12-04 09:07:04,"Biden, facing increasing pressure to appoint Black and Latino nominees to remaining high-level Cabinet posts: ""I'm… https://t.co/NVPIaJY9h9"
1334786286956195841,2020-12-04 09:07:04,"Vice President-elect Kamala Harris acknowledges the challenges awaiting the administration’s climate plan: ""Our age… https://t.co/pBAq6FXVNY"
1334785031466864641,2020-12-04 09:02:05,"""We are living in the political equivalent of climate change -- of extreme weather. And I don't think that's going… https://t.co/tvq9sJoA7w"
1334784782161616896,2020-12-04 09:01:05,A United Nations commission has voted to remove cannabis from a list that categorized it as one of the most dangero… https://t.co/yO8PlDtZy0
1334781774988259328,2020-12-04 08:49:08,"Matthew Travis, a former cybersecurity official, says “the President and his administration should take pride in ho… https://t.co/JC2gdmB8hG"
1334780136797986818,2020-12-04 08:42:38,A new metal monolith appeared in a California park just days after another mysterious monument disappeared from a r… https://t.co/BcmYGddTLA
1334777227813249030,2020-12-04 08:31:04,The two largest planets in our solar system are coming closer together than they have been since the Middle Ages https://t.co/cEnpgH6g3B
1334773471633666048,2020-12-04 08:16:09,"""My primary goal as a contact tracer is to give the general public information and I am hopeful they use that infor… https://t.co/OnA7Dob99I"
1334772964957499398,2020-12-04 08:14:08,"A Chinese startup has announced that it's rolled out fully driverless robotaxis on public roads in Shenzhen, claimi… https://t.co/o1vWIMZpiR"
1334771434070151168,2020-12-04 08:08:03,"""Our community completely saved us""

A Toronto bar owner says her business will survive the coronavirus pandemic th… https://t.co/rvHC0aynd7"
1334769673548804096,2020-12-04 08:01:03,"""The Lord of the Rings"" cast is crowdfunding to buy J.R.R. Tolkien's home in Oxford, England, and turn it into a li… https://t.co/yLs1SBmVgL"
1334765902701731841,2020-12-04 07:46:04,"While many Republican senators have not publicly acknowledged him as the President-elect, Joe Biden says ""more than… https://t.co/r8FIDQU8i6"
1334764626102239233,2020-12-04 07:41:00,North Carolina Gov. Roy Cooper is calling on the Trump administration to lead on mask wearing in order to help miti… https://t.co/rrUKTk9wOo
1334762131158347776,2020-12-04 07:31:05,"Former Presidents Barack Obama, George W. Bush and Bill Clinton are volunteering to get their Covid-19 vaccines on… https://t.co/hiZfhqRI6H"
1334760311832932352,2020-12-04 07:23:51,"Rick Bright, the former director of a key federal vaccine agency, says Americans hosting holiday parties despite a… https://t.co/MIR73wJZJ2"
1334760293877035010,2020-12-04 07:23:47,Rep. Karen Bass says the Congressional Black Caucus has been in communication with the incoming Biden administratio… https://t.co/giqQXTX2kx
1334758354602909696,2020-12-04 07:16:05,"""The protocol of the transfer of power, I think, is important. But it is totally his decision, and it's of no perso… https://t.co/a79wxHEP24"
1334756967626153986,2020-12-04 07:10:34,"RT @AC360: Pres. Trump claimed we have found ""massive fraud"" in Arizona, days after the state certified President-elect Biden's win.

 ""We…"
1334756820552806401,2020-12-04 07:09:59,"RT @CNNTonight: As coronavirus cases surge across the nation, Dr. Chris Murray, researcher behind an influential coronavirus model from the…"
1334754579041427456,2020-12-04 07:01:04,A record-setting hurricane season just ended. Here’s what scientists are most confident is happening to hurricanes… https://t.co/AokKipveYX
1334750784718835713,2020-12-04 06:46:00,"“I’ve been doing this work for more than 30 years and it’s never been at this level of need,” says Michael Flood, p… https://t.co/tgXLoq7xqy"
1334747023837421569,2020-12-04 06:31:03,"Wuhan, the Chinese city once at the epicenter of the coronavirus pandemic, has launched a new promotional video as… https://t.co/WEOOebiW94"
1334743257805414400,2020-12-04 06:16:05,The Trump administration has sued Facebook for allegedly passing over US job candidates for thousands of positions… https://t.co/80VcURFJvv
1334739480796917768,2020-12-04 06:01:05,China this week revealed plans to drastically expand an experimental weather modification program to cover an area… https://t.co/F74VhiNgtU
1334731928717709319,2020-12-04 05:31:04,"Blackpink's first livestream concert will include performances of songs from ""The Album,"" which the group released… https://t.co/VbqGiTi9fc"
1334729709158977537,2020-12-04 05:22:15,The Trump administration sued Facebook for allegedly passing over US job candidates for thousands of positions in f… https://t.co/OvbcLFO0X9
1334728471277416448,2020-12-04 05:17:20,Millions of Californians may soon find themselves under stay home orders once again due to new restrictions announc… https://t.co/2lheG9k9Gu
