id,created_at,text
1332802728775589890,2020-11-28 21:45:07,"Statues or storefronts in Minneapolis, Portland, Spokane and Chicago were targeted by vandals on Thanksgiving.
https://t.co/HBoAxcnDiQ"
1332798693280518146,2020-11-28 21:29:05,There will likely be a limited supply of coronavirus vaccine doses available immediately after a vaccine is authori… https://t.co/rclTUjAGtZ
1332795417780740100,2020-11-28 21:16:04,Children younger than two who are given antibiotics are more likely to have a number of ongoing illnesses or condit… https://t.co/U989jU8h6E
1332791441408593923,2020-11-28 21:00:16,It’s an alarming statistic and a trend that’s reflected all over the country. @LisaLing discovers why so many young… https://t.co/vSXZ3mtxKI
1332788295143710724,2020-11-28 20:47:46,"Actor Sean Penn, cofounder of the nonprofit CORE, says that more federal Covid-19 funding is needed. His organizati… https://t.co/DVN80t1ABx"
1332787631114096642,2020-11-28 20:45:07,"Standing at 200 meters above ground, when completed in 2022 Airside will become the tallest landmark occupying the… https://t.co/pqiNQTSWXn"
1332783583552020481,2020-11-28 20:29:02,"Ryan Reynolds and Blake Lively pledged $250,000 each to Covenant House Vancouver and Covenant House Toronto, accord… https://t.co/ylM2WA44J6"
1332780068393848837,2020-11-28 20:15:04,"A second young man has died after a shooting in a Sacramento mall, police said Saturday. https://t.co/eogPGbzqG8"
1332776321261461504,2020-11-28 20:00:11,Incumbent Sens. David Perdue and Kelly Loeffler are facing tough reelection battles in two January runoff elections… https://t.co/kOG4aGRBNO
1332772510631333888,2020-11-28 19:45:02,"• Consider the benefits of working out at home
• Select a space that won't disrupt your lifestyle
• Design your spa… https://t.co/vEEPZC9xO1"
1332768750215585794,2020-11-28 19:30:06,The behavior of those who follow the fake conspiracy theory QAnon -- their supposed efforts to help abused children… https://t.co/gB2FN9bf5l
1332765221182722052,2020-11-28 19:16:04,The budget office identified 425 of its employees -- including analysts and other experts -- who would switch to a… https://t.co/HrBSJim54c
1332761210064949250,2020-11-28 19:00:08,"Based on current Covid-19 numbers in the US, we're far from rounding the corner, Dr. Leana Wen, an emergency physic… https://t.co/yMdsn2iL9q"
1332757426165182469,2020-11-28 18:45:06,"Beginning December 1, refinancing will likely cost homeowners more. Fannie Mae and Freddie Mac will charge a new --… https://t.co/jkzU54r17J"
1332753662091915266,2020-11-28 18:30:09,"The apparent goal of Iran's enemies, and possibly Iran itself, is in the next 50 days -- ahead of the US inaugurati… https://t.co/ar14aiPcNJ"
1332753292020092937,2020-11-28 18:28:40,"“We are around 30% short of meeting the demand that we're already seeing,” Central Texas Food Bank President Derric… https://t.co/t2qZ3uk2U4"
1332749873347751937,2020-11-28 18:15:05,"Former undisputed heavyweight champion Mike Tyson, 54, will go against former four-division world champion Roy Jone… https://t.co/JcxZrou7EZ"
1332746103188561922,2020-11-28 18:00:06,A Florida man who has spent 31 years in prison for a nonviolent marijuana crime could be released as early as Decem… https://t.co/8OMwdIJhcb
1332744214661173249,2020-11-28 17:52:36,College football history could be made Saturday if Sarah Fuller steps on the field during Vanderbilt University's g… https://t.co/znfsV8oSsr
1332742329342562305,2020-11-28 17:45:07,"Several people have already successfully located the monolith, tucked in a redrock slot canyon south of Moab. And a… https://t.co/Qo7t2SNmRI"
1332738290953449477,2020-11-28 17:29:04,If the questions over Oxford University's and AstraZeneca's Covid-19 vaccine results are answered and it receives a… https://t.co/zaC8597QlG
1332735661749776386,2020-11-28 17:18:37,"“You think [about] what happened in March and April, if that comes back again … it’d be really rough for us. And I… https://t.co/5ImAQYANVV"
1332734776739041292,2020-11-28 17:15:06,"Tony Hsieh, former Zappos CEO and ""tremendous visionary,"" dies at 46 https://t.co/Mw6qBvoIiw https://t.co/z30Bv6w3Hv"
1332731497124667392,2020-11-28 17:02:04,"Norton County, Kansas, which was spared by earlier surges during the pandemic's deadly grip on Midwestern rural com… https://t.co/7rkewucu8V"
1332728134928625666,2020-11-28 16:48:42,Trump found himself trapped in an election riddle of his own making -- continuing to push false claims that the ele… https://t.co/yZlNKH6gRB
1332719908975685635,2020-11-28 16:16:01,The campaign of a spoiler candidate appeared to help a Republican unseat the Democratic incumbent in a Florida Sena… https://t.co/IqJMsfA4xN
1332719842932174848,2020-11-28 16:15:45,"Pope Francis has elevated Archbishop Wilton Gregory to cardinal, the first African American in Catholic history to… https://t.co/FCHyrczypq"
1332716158223527939,2020-11-28 16:01:07,"Archaeologists in Egypt have uncovered at least 100 perfectly preserved ancient coffins, some containing mummies, a… https://t.co/KyyGdJ5zNS"
1332711870709571584,2020-11-28 15:44:05,The only known white giraffe in the world has been fitted with a GPS tracking device in an effort to protect him fr… https://t.co/zRuR357GI0
1332708368289570819,2020-11-28 15:30:10,Examine the relationship between the American President and Vice President with exclusive interviews from Barack Ob… https://t.co/L0Yi7avqqS
1332704821854556160,2020-11-28 15:16:04,"New US Covid-19 cases are surging, along with hospitalization rates and deaths. Health experts say this will only g… https://t.co/YzRpVqOABS"
1332701051884105729,2020-11-28 15:01:05,"Mask mandates work to slow the spread of Covid-19, according to new research published by the US Centers for Diseas… https://t.co/Kocd3afm2e"
1332699550428123136,2020-11-28 14:55:07,"Former Rep. and 2020 candidate John Delaney says Americans should be paid $1,500 to take a coronavirus vaccine. 

“… https://t.co/Y0P03IZuer"
1332696380889059328,2020-11-28 14:42:32,"In a 5-4 ruling, the Supreme Court sided with religious groups in a dispute over Covid-19 restrictions in New York.… https://t.co/vWzC48xhFC"
1332693493500833796,2020-11-28 14:31:03,"US is ""rounding the corner into a calamity,"" an expert says, with Covid-19 deaths projected to double soon… https://t.co/x3cBfcuSF1"
1332693071092445186,2020-11-28 14:29:23,"Business trends have gone through years of change in just a few months due to the Covid-19 pandemic, marketing prof… https://t.co/3W7dBIV47o"
1332689725556133889,2020-11-28 14:16:05,"The Federal Aviation Administration says it has supported ""the first mass air shipment"" of a Covid-19 vaccine.… https://t.co/F6xlRsChRT"
1332685947985649667,2020-11-28 14:01:04,Lawmakers in Taiwan threw pig intestines and punches at each other as a brawl broke out in parliament over a propos… https://t.co/phjmnQRfrg
1332681670701559810,2020-11-28 13:44:04,Iran's supreme leader vows revenge after the apparent assassination of the country's chief nuclear scientist… https://t.co/8imKrK8w0U
1332677885577080832,2020-11-28 13:29:02,"One person is dead and another is hospitalized in critical condition after a shooting in a Sacramento mall, accordi… https://t.co/U9WOaPT7tj"
1332674284418949121,2020-11-28 13:14:43,"Tony Hsieh, former Zappos CEO and ""tremendous visionary,"" dies at 46 https://t.co/8iQbvg1aBC https://t.co/wf2jEqIZ3f"
1332670851502772226,2020-11-28 13:01:05,Watch this prototype flying car complete its first flight https://t.co/tpuKUufJZF https://t.co/0UXHAEbyS4
1332664307264458752,2020-11-28 12:35:05,"More than 20,000 species of bee exist throughout the world — and they are dying. Researchers have taken an importan… https://t.co/UteIRdV5PA"
1332655771969064960,2020-11-28 12:01:10,This new car carrier is the world's largest wind-powered vessel -- and it has the tallest ship sails that have ever… https://t.co/NJcsYTcK12
1332647971578580992,2020-11-28 11:30:10,A Covid-19 patient played the violin while on a ventilator in the ICU to thank health care workers… https://t.co/MdVkqd6zca
1332640652161638401,2020-11-28 11:01:05,"Macy's says its 2020 holiday window displays are ""a form of a thank you letter to first responders, essential worke… https://t.co/mSgx9Pg1u8"
1332632856410120193,2020-11-28 10:30:06,Dinosaurs were doing well and could have continued to dominate Planet Earth if they had not been wiped out by an as… https://t.co/etlRGrlcMq
1332625542290477057,2020-11-28 10:01:02,"Scotland has become the first country to allow free and universal access to menstrual products, including tampons a… https://t.co/Zgp5TxoVPH"
1332618004673286144,2020-11-28 09:31:05,"At the vanguard of robotics innovation, Japan is home to seven of the 10 world-leading industrial robotics companie… https://t.co/VCRtvSIkLW"
1332610451918688257,2020-11-28 09:01:05,"What started as a routine flyover suddenly took a turn after Utah officers stumbled upon a shiny, mysterious monoli… https://t.co/B5OAjIsEfT"
1332603141053952000,2020-11-28 08:32:02,When neighbors found out that 7-year-old Ally Cheek's health was declining and she might not live through the holid… https://t.co/bxE7NZB2WI
1332595357512044545,2020-11-28 08:01:06,"Vegans may be at higher risk for bone fractures, study finds https://t.co/kzxOuKCRHq https://t.co/aq1liexEap"
1332580255954034689,2020-11-28 07:01:05,An 85-year-old primary school in Shanghai has been lifted off the ground — in its entirety — and relocated using ne… https://t.co/fsMgsUERGE
1332565153389404162,2020-11-28 06:01:05,"Watch this pianist attempt to serenade a pack of monkeys in the ancient city of Lopburi, Thailand… https://t.co/pAsPacfAnc"
1332557608633372675,2020-11-28 05:31:06,Australian airline Qantas will require future international travelers to prove they have been vaccinated against Co… https://t.co/UbxYG4gWPJ
1332550075998932992,2020-11-28 05:01:10,"A pioneer in gaming culture, Japan has created many of the world's most iconic and successful video games. Its gami… https://t.co/1xfCDzyejv"
1332534745679486979,2020-11-28 04:00:15,"Vegans may be at higher risk for bone fractures, study finds https://t.co/y8sp3qIyGK"
1332519866914443269,2020-11-28 03:01:07,"Disney's new robot may be the stuff of nightmares, but it's actually supposed to look more lifelike and respond to… https://t.co/se1OKzej4I"
1332512063801991169,2020-11-28 02:30:07,"Understanding, acceptance, and a place where all are welcome. #ThisIsLife with @LisaLing hopes to open your eyes an… https://t.co/i2wZqFGSy2"
1332504755189460995,2020-11-28 02:01:05,"Scientists have pioneered a new technique that allows them to investigate the insides of a 1,900-year-old mummy — w… https://t.co/aTOdPHpWTY"
1332497211138007040,2020-11-28 01:31:06,"People who spend more time on their phones are more likely to reject larger, delayed rewards in favor of smaller, i… https://t.co/UBgd96A6en"
1332489651211407364,2020-11-28 01:01:03,"Macy's says its 2020 holiday window displays are ""a form of a thank you letter to first responders, essential worke… https://t.co/hnUz3NXG6l"
1332485633894469633,2020-11-28 00:45:06,"""The Supreme Court's ruling against New York state's decision to limit religious gatherings in a few high-incidence… https://t.co/F04PQiYBYQ"
1332481876167159809,2020-11-28 00:30:10,Biden and his team will soon have to decide whether to share transcripts of presidential calls with foreign leaders… https://t.co/Gb8ZHoICXO
1332478098055557122,2020-11-28 00:15:09,"""I decided to get engaged,"" Matthew Perry said. ""Luckily, I happened to be dating the greatest woman on the face of… https://t.co/WRfB3L6E1K"
1332474554325798914,2020-11-28 00:01:04,Dinosaurs were doing well and could have continued to dominate Planet Earth if they had not been wiped out by an as… https://t.co/Kvr8rQYDkc
1332470532881707008,2020-11-27 23:45:05,"Trees will start to shed their leaves earlier as the planet warms, a new study suggests, contradicting previous ass… https://t.co/K9d8m3QL8a"
1332466789779968003,2020-11-27 23:30:13,"A new map by Japanese space experts suggests the black hole at the center of our galaxy is located 25,800 light-yea… https://t.co/qc0Ml0vs02"
1332462979850362880,2020-11-27 23:15:05,"""We wear Black Lives Matter to affirm human decency,"" members of the United States women's national soccer team sai… https://t.co/jhKc8zMKhD"
1332459456710447105,2020-11-27 23:01:05,"Canadians, officials have an important message for you: ""Do not let moose lick your car.""

Yes, you read that right. https://t.co/zfDqO6OczT"
1332455422666661891,2020-11-27 22:45:03,"Taking action to protect others around you will help mitigate the spread of Covid-19, especially with Hanukkah, Chr… https://t.co/SRjTlF4X6Q"
1332451691711574016,2020-11-27 22:30:13,"Alex Trebek, the late host of the long-running game show ""Jeopardy!,"" had a Thanksgiving message for viewers, urgin… https://t.co/u4Pskf7kCM"
1332447902350913537,2020-11-27 22:15:10,"There have been more than 13 million cases of coronavirus in the US, according to Johns Hopkins University's count.… https://t.co/wcEDXNuOXH"
1332444372068167681,2020-11-27 22:01:08,This new car carrier is the world's largest wind-powered vessel -- and it has the tallest ship sails that have ever… https://t.co/fZ5mbOzMfv
1332440335331495937,2020-11-27 21:45:06,The campaign of a spoiler candidate appeared to help a Republican unseat the Democratic incumbent in a Florida Sena… https://t.co/s8I36mNdwM
1332436588765335552,2020-11-27 21:30:12,What is it like to have the second most powerful job in the world? All six living Vice Presidents give you the insi… https://t.co/Fb1B37XIUq
1332432792945369088,2020-11-27 21:15:07,CDC advisers will vote next week on which groups of people they recommend get the coronavirus vaccine first once on… https://t.co/9uI2GyM1VR
1332429279959932931,2020-11-27 21:01:10,"At the vanguard of robotics innovation, Japan is home to seven of the 10 world-leading industrial robotics companie… https://t.co/uBnjDjtKH6"
1332425246050234368,2020-11-27 20:45:08,"Bruce Boynton, a civil rights icon and attorney who helped inspire the historic Freedom Rides of 1961, has died at… https://t.co/7byXAR8rzQ"
1332421476247621632,2020-11-27 20:30:09,College students' choice to return home for the holidays as the semester ends and cases continue to surge nationwid… https://t.co/ck6NhR0L1r
1332417686790397958,2020-11-27 20:15:06,The only known white giraffe in the world has been fitted with a GPS tracking device in an effort to protect him fr… https://t.co/p2X96EHUZy
1332414163235311622,2020-11-27 20:01:06,"An ancient Islamic necropolis containing over 4,500 bodies has been uncovered in northeastern Spain, with archaeolo… https://t.co/5710Uh5G30"
1332406620853325827,2020-11-27 19:31:07,"This mom is honoring the memory of her late daughter, who loved to sew, by using her sewing machine to craft face m… https://t.co/3bbGAGdZSS"
1332402575753220098,2020-11-27 19:15:03,A federal appeals court has denied the Trump campaign's effort to revive a challenge to Pennsylvania's election res… https://t.co/Ls532QXmmR
1332399061324996611,2020-11-27 19:01:05,A Covid-19 patient played the violin while on a ventilator in the ICU to thank health care workers… https://t.co/R8WFeFavdc
1332391266894700546,2020-11-27 18:30:07,This archbishop is about to become the first African American cardinal in Catholic history https://t.co/O0eNVOZz9r https://t.co/XlLDqdpPlm
1332383953488121862,2020-11-27 18:01:03,When neighbors found out that 7-year-old Ally Cheek's health was declining and she might not live through the holid… https://t.co/t6rsLAd1EU
1332383687380406272,2020-11-27 18:00:00,How Japan is a testing ground for robotics technology https://t.co/RLciJGzcdl https://t.co/Sbk6ZFUffE
1332376200703078401,2020-11-27 17:30:15,Trump's loss dealt a blow to global populism. But the movement is still alive and kicking | Analysis by… https://t.co/bZLtvNpCYa
1332368690243915777,2020-11-27 17:00:24,"His choices as a boy altered the course of his life forever. Now, he’s making sure young men don’t follow the same… https://t.co/ZNCkfMdUua"
1332361073945620482,2020-11-27 16:30:08,"True wireless earbuds (yes, #AirPodsPro included), tablets, streaming sticks, TVs, laptops, tablets and phones are… https://t.co/iomJ2ZOykp"
1332353527168049153,2020-11-27 16:00:09,North Korean hackers are suspected to have carried out a cyberattack against British coronavirus vaccine developer… https://t.co/McnehMM2C1
1332349738075770880,2020-11-27 15:45:06,"If you didn't have many Thanksgiving guests to send home with turkey and casserole leftovers, you may need to get c… https://t.co/7p05Wf20Hf"
1332345973314621440,2020-11-27 15:30:08,"JUST IN: One of Iran's top nuclear scientists was killed in an apparent assassination near Tehran, state media repo… https://t.co/4CvV4oyv89"
1332342192728367104,2020-11-27 15:15:07,"""If you were to shake a Neanderthal hand you would notice this difference.""

Neanderthals used their hands differen… https://t.co/VYTtlARCfN"
1332338655000727553,2020-11-27 15:01:03,"Archaeologists in Egypt have uncovered at least 100 perfectly preserved ancient coffins, some containing mummies, a… https://t.co/WR5Pty8P4r"
1332336909960564737,2020-11-27 14:54:07,"RT @NewDay: Seven members of a Minnesota family tested positive for coronavirus, spurring them to speak out.
 
“It makes you want to yell o…"
1332336854809665536,2020-11-27 14:53:54,"RT @NewDay: As 12 million Americans are at risk of losing their pandemic unemployment benefits right after Christmas, personal finance colu…"
1332334639063703553,2020-11-27 14:45:06,"Pentagon officials say the trip's purpose is to meet with troops during the holiday, but it comes amid reports that… https://t.co/X118u0vL19"
1332330873866362884,2020-11-27 14:30:08,"""I can't make the negative stuff disappear, but I can put something positive out there.""

Julie Smith has gained 2.… https://t.co/Xx3e5N2VlU"
1332329322418409473,2020-11-27 14:23:58,Our colleagues at @CNNUnderscored have created a guide to the must-shop #BlackFriday deals of the day. Shop now: https://t.co/8cSuQBkSds
1332327112452272129,2020-11-27 14:15:11,Children younger than two who are given antibiotics are more likely to have a number of ongoing illnesses or condit… https://t.co/NmLGCyozlQ
1332323558412914688,2020-11-27 14:01:04,"Mask mandates work to slow the spread of Covid-19, according to new research published by the US Centers for Diseas… https://t.co/xaDy8Kjhvc"
1332319538327785476,2020-11-27 13:45:05,"Thanksgiving Day marked the 24th consecutive day that the US has reported more than 100,000 new coronavirus cases.… https://t.co/whJR0gMeWg"
1332317773767340032,2020-11-27 13:38:05,"Companies are hoping to avoid the crush of customers that crowd stores on Black Friday by giving them more buying,… https://t.co/yhSMKVrXKA"
1332315777702252545,2020-11-27 13:30:09,"“We are very concerned as a continent that we will not have access to vaccines in a timely fashion.""

Vaccinations… https://t.co/VgypSsx6Ji"
1332311988446302210,2020-11-27 13:15:05,President Donald Trump said Thursday he will travel to Georgia to support the state's Republican Senate candidates… https://t.co/Gw820rKv6p
1332308191649083392,2020-11-27 13:00:00,"""We've gone numb. ... We are fully expecting the next few weeks to be brutal, and at this point, honestly, we just… https://t.co/zCW532eolK"
1332304429404532737,2020-11-27 12:45:03,"More than 20,000 species of bee exist throughout the world — and they are dying. Researchers have taken an importan… https://t.co/IDLIQFUFdc"
1332300700139851780,2020-11-27 12:30:14,"""President Donald Trump finally confirmed Thursday that he will vacate the White House in January after weeks of pl… https://t.co/ZD1XEEjSaw"
1332293127336566784,2020-11-27 12:00:09,"Alex Trebek, the late host of the long-running game show ""Jeopardy!,"" had a Thanksgiving message for viewers, urgin… https://t.co/2AF4SUjUDB"
1332289339292848128,2020-11-27 11:45:05,Watch this prototype flying car complete its first flight https://t.co/QO7QA4luYU https://t.co/9p9nSt1sMz
1332285578642153472,2020-11-27 11:30:09,President Donald Trump said for the first time Thursday he will leave office if the Electoral College votes for Pre… https://t.co/hkB5xfEeSZ
1332281539779059714,2020-11-27 11:14:06,Trump's loss dealt a blow to global populism. But the movement is still alive and kicking | Analysis by… https://t.co/9xcu5eFO4X
1332278043159752705,2020-11-27 11:00:12,"Five people were shot, one fatally, and two suspects were arrested in Henderson, Nevada early Thanksgiving morning,… https://t.co/WfPFWggzM7"
1332274230034124800,2020-11-27 10:45:03,"""If you were to shake a Neanderthal hand you would notice this difference.""

Neanderthals used their hands differen… https://t.co/cyjsKIDEUF"
1332270478426329089,2020-11-27 10:30:09,The Covid-19 pandemic is raging across the US -- already more devastating than previous surges and showing no signs… https://t.co/ywxIjOYwrs
1332266689111748608,2020-11-27 10:15:05,"""I can't make the negative stuff disappear, but I can put something positive out there.""

This therapist fights onl… https://t.co/OVjinCEaO0"
1332263155804811264,2020-11-27 10:01:03,This new car carrier is the world's largest wind-powered vessel -- and it has the tallest ship sails that have ever… https://t.co/V9ithWX3m7
1332259140786409479,2020-11-27 09:45:05,"A 31-year-old man has been jailed for 21 months for throwing eggs at a police station, the latest tough sentence ha… https://t.co/bpOLtqIXgI"
1332256364773642241,2020-11-27 09:34:04,The Utah Division of Wildlife Resources built a bridge back in 2018 and just released a video of the bridge in use… https://t.co/ybVboOfR4V
1332251586538704897,2020-11-27 09:15:04,Six US oil executives who traveled to Venezuela in 2017 and were arrested on corruption charges have been found gui… https://t.co/J1OpWMhwIU
1332248062081855488,2020-11-27 09:01:04,An 85-year-old primary school in Shanghai has been lifted off the ground — in its entirety — and relocated using ne… https://t.co/2MONoBK925
1332244657535918080,2020-11-27 08:47:32,"""President Donald Trump finally confirmed Thursday that he will vacate the White House in January after weeks of pl… https://t.co/RyL7sBLv24"
1332240281731801091,2020-11-27 08:30:09,President Donald Trump said for the first time Thursday he will leave office if the Electoral College votes for Pre… https://t.co/25xfUMtG2z
1332240271300505603,2020-11-27 08:30:07,A lack of clarity surrounding several aspects of the data from the AstraZeneca vaccine trials have raised some eyeb… https://t.co/c1OkXUQYGS
1332236507634077697,2020-11-27 08:15:09,China slaps duties of up to 212% on Australian wine imports https://t.co/eeWoisNVJK https://t.co/eVGkTOUajg
1332232958112129024,2020-11-27 08:01:03,Australian airline Qantas will require future international travelers to prove they have been vaccinated against Co… https://t.co/qB1OszTERo
1332230703300407297,2020-11-27 07:52:05,The Covid-19 pandemic is raging across the US -- already more devastating than previous surges and showing no signs… https://t.co/R2wxHoj9t0
1332224656380747777,2020-11-27 07:28:04,"Step aside ""murder hornets,"" sightings of an invasive species of a snake-like worm are being reported in Georgia https://t.co/eAhLJKxgwW"
1332217873511690240,2020-11-27 07:01:07,"Watch this pianist attempt to serenade a pack of monkeys in the ancient city of Lopburi, Thailand… https://t.co/NF2GSEHM0c"
1332210068943679493,2020-11-27 06:30:06,"Michael Jordan has donated $2 million in proceeds from the hit documentary ""The Last Dance"" to help feed hungry peo… https://t.co/i1cNrfTjHz"
1332202757416226820,2020-11-27 06:01:03,"Nearly a third of the nurses who've died of coronavirus in the US are Filipino, even though Filipino nurses make up… https://t.co/uBV8CB61E5"
1332195229101944842,2020-11-27 05:31:08,"A pioneer in gaming culture, Japan has created many of the world's most iconic and successful video games. Its gami… https://t.co/5YYj2r3jWv"
1332187671683330049,2020-11-27 05:01:06,"Scotland has become the first country to allow free and universal access to menstrual products, including tampons a… https://t.co/58cFfxoKnp"
1332179616430252033,2020-11-27 04:29:05,"Vegans may be at higher risk for bone fractures, study finds https://t.co/j6vHvCaZpR"
1332172585728155649,2020-11-27 04:01:09,An 85-year-old primary school in Shanghai has been lifted off the ground — in its entirety — and relocated using ne… https://t.co/a4waL6D7rW
1332164263042048001,2020-11-27 03:28:05,"As new coronavirus cases explode nationwide, health officials are turning to cell phones to help slow the spread of… https://t.co/3gi9zYa3Vb"
1332157490377728001,2020-11-27 03:01:10,"Disney's new robot may be the stuff of nightmares, but it's actually supposed to look more lifelike and respond to… https://t.co/k7nmsA1F6R"
1332148904935251969,2020-11-27 02:27:03,"Taylor Swift has revealed that her British actor boyfriend, Joe Alwyn, is the mystery co-writer credited on her lat… https://t.co/jHCxZnYT2Z"
1332142373464313857,2020-11-27 02:01:06,"Scientists have pioneered a new technique that allows them to investigate the insides of a 1,900-year-old mummy — w… https://t.co/MWChrvboXq"
1332134301387919360,2020-11-27 01:29:01,"""Whose Time to Care?"" report, from UN Women, found that, while both women and men have taken on extra unpaid domest… https://t.co/dTyZiuFOHA"
